MCQ,Choices,Correct
Who coined the term 'machine learning'?,a: Donald Hebb | b: Arthur Samuel | c: Walter Pitts | d: Warren McCulloch,b
What was the purpose of the 'Cybertron' learning machine?,a: To play checkers | b: To analyze sonar signals | c: To recognize characters | d: To predict stock prices,b
"According to Tom M. Mitchell's definition, what is the goal of machine learning?",a: To improve performance on tasks | b: To understand human cognitive processes | c: To create artificial intelligence | d: To classify data,a
Which of the following is NOT an objective of modern-day machine learning?,a: Data classification | b: Prediction | c: Pattern recognition | d: Natural language processing,c
What was the theoretical neural structure introduced by Donald Hebb called?,a: Cybertron | b: Learning Machine | c: Neural Network | d: Artificial Neuron,c
